{
  "notebookId": "81428ffe-ebdd-46d4-a990-be2bed3fbdaa",
  "name": "Hello Docker",
  "connectionParams": {
    "hyper": {
      "protocol": "V3_DOCKER",
      "endpoint": "http://localhost:7484",
      "tls": {
        "clientKeyPath": "",
        "clientCertPath": "",
        "caCertsPath": ""
      },
      "attachedDatabases": [],
      "metadata": {},
      "queryParameters": {
        "user": "tableau_internal_user"
      }
    }
  },
  "metadata": {
    "createdAt": "2026-06-30T08:18:52.125Z"
  }
}