{
  "notebookId": "92a09cb7-5f7d-4f8e-8c78-0dc39d8fff36",
  "name": "Hello Wasm",
  "connectionParams": {
    "hyper": {
      "protocol": "WASM",
      "endpoint": "",
      "tls": {
        "clientKeyPath": "",
        "clientCertPath": "",
        "caCertsPath": ""
      },
      "attachedDatabases": [],
      "metadata": {},
      "queryParameters": {}
    }
  },
  "metadata": {
    "createdAt": "2026-08-29T08:49:25.338Z"
  }
}